id,question
0,What are the main ingredients for the Ground Beef Gyros?
0,How long does it take to cook the Ground Beef Gyros?
0,What kind of sauce is recommended with the Ground Beef Gyros?
0,Can turkey be used instead of beef in Ground Beef Gyros?
0,How is the Ground Beef Gyros rated by those who have tried it?
1,How long does the Lasagna take to cook?
1,What type of cheese does the Lasagna recipe suggest using?
1,Can you use ricotta instead of cottage cheese in this Lasagna?
1,How do you prepare the baking pan for the Lasagna?
1,What is the oven temperature for baking the Lasagna?
2,What is the name of the recipe that claims to be easy to make?
2,How long does it take to cook The Best Easy Beef & Broccoli Stir-Fry?
2,What garnish is optionally suggested for The Best Easy Beef & Broccoli Stir-Fry?
2,What type of steak is recommended for The Best Easy Beef & Broccoli Stir-Fry?
2,How many stars has The Best Easy Beef & Broccoli Stir-Fry been rated?
3,How long does it take to make The Ultimate Greek Salad?
3,What type of olives does The Ultimate Greek Salad recipe use?
3,Can lettuce be included in The Ultimate Greek Salad according to the description?
3,What is the rating for The Ultimate Greek Salad?
3,What kind of cheese is used in The Ultimate Greek Salad?
4,How long does it take to make the Easy Stovetop Macaroni 'n' Cheese?
4,What kind of cheese is used in the Easy Stovetop Macaroni 'n' Cheese?
4,How is the Easy Stovetop Macaroni 'n' Cheese cooked?
4,What is the user rating for the Easy Stovetop Macaroni 'n' Cheese?
4,Do you need to bake the Easy Stovetop Macaroni 'n' Cheese?
5,How long do you need to cook Bev's Spaghetti Sauce?
5,What meat should you use in Bev's Spaghetti Sauce?
5,What type of cheese is suggested for topping Bev's Spaghetti Sauce?
5,How is the flavor of Bev's Spaghetti Sauce described by the creator?
5,What overall rating does Bev's Spaghetti Sauce have?
6,How much oil or shortening is recommended for the Perfect Southern Fried Chicken?
6,What is the total cooking time for the Perfect Southern Fried Chicken?
6,How many pieces is the chicken cut into for the Perfect Southern Fried Chicken?
6,What is the rating for the Perfect Southern Fried Chicken recipe?
6,What is the purpose of covering the chicken at the beginning of the cooking process in the Perfect Southern Fried Chicken?
7,How long does it take to cook Chicken Fried Rice?
7,What kind of meat can be used in Chicken Fried Rice?
7,When should sesame oil be added in the Chicken Fried Rice recipe?
7,What is the rating of the Chicken Fried Rice recipe?
7,What vegetables are included in the Chicken Fried Rice ingredients?
8,How long does it take to cook the Sloppy Joes?
8,What is the main protein ingredient in the Sloppy Joes?
8,What star rating does the Sloppy Joes recipe have?
8,Is mustard necessary in the Sloppy Joes recipe?
8,How are the onions prepared in the Sloppy Joes recipe?
9,How long does it take to cook the Chicken Parmesan?
9,What's the main protein ingredient in the Chicken Parmesan recipe?
9,How is the chicken seasoned in the Chicken Parmesan recipe?
9,What type of cheese is placed on top of the Chicken Parmesan?
9,Is serving spaghetti with the Chicken Parmesan mandatory according to the recipe?
10,How long does it take to cook the Leftover Mashed Potato Pancakes?
10,What ingredients do you need for Leftover Mashed Potato Pancakes?
10,What can you serve with Leftover Mashed Potato Pancakes?
10,What is the rating for the Leftover Mashed Potato Pancakes recipe?
10,Do the Leftover Mashed Potato Pancakes recipe include onions and chives as mandatory ingredients?
11,What's the main ingredient in Simple Pasta Toss?
11,How long does it take to prepare Simple Pasta Toss?
11,Can you add cheese to Simple Pasta Toss if you want?
11,What seasonings are used in Simple Pasta Toss?
11,Is there any chicken in Simple Pasta Toss?
12,What's the cooking time for the Scalloped Potatoes?
12,How much cheese goes into the Scalloped Potatoes?
12,Can you describe the Scalloped Potatoes recipe?
12,What rating did the Scalloped Potatoes receive?
12,What's the first step in preparing the Scalloped Potatoes?
13,How long does it take to cook Jo Mama's World Famous Spaghetti?
13,What type of meat is used in Jo Mama's World Famous Spaghetti?
13,How is the red wine described in Jo Mama's World Famous Spaghetti?
13,What should be sprinkled on Jo Mama's World Famous Spaghetti before serving?
13,What is added to Jo Mama's World Famous Spaghetti after bringing the sauce to a boil?
14,What is the total cooking time for the Turkey Meatloaf?
14,How many eggs or egg substitute is used in the Turkey Meatloaf recipe?
14,What is the oven temperature for baking the Turkey Meatloaf?
14,How many cloves of garlic are needed in the Turkey Meatloaf?
14,What is one of the main seasonings in the Turkey Meatloaf besides salt and pepper?
15,What's the total cooking time for the Mexican Rice recipe?
15,Can canned tomatoes be used in place of fresh ones for the Mexican Rice recipe?
15,How many jalapenos does the Mexican Rice recipe call for?
15,Does the Mexican Rice recipe include a step for using a rice cooker?
15,Is the Mexican Rice recipe described as having a tomato flavor?
16,How long do the Pizza Meatloaf Cups take to cook?
16,What kind of cheese is used in the Pizza Meatloaf Cups?
16,What temperature should the oven be set to for baking Pizza Meatloaf Cups?
16,Can Pizza Meatloaf Cups be frozen for later use?
16,How much ground beef is needed for the Pizza Meatloaf Cups recipe?
17,What is the name of the recipe that uses only a stovetop for cooking?
17,How long does it take to cook the Stovetop Tuna Casserole?
17,What type of cheese is included in the Stovetop Tuna Casserole ingredients?
17,How is the tuna prepared in the Stovetop Tuna Casserole recipe before adding it to the dish?
17,What is the overall rating of the Stovetop Tuna Casserole based on 32 reviews?
18,What is the name of this rice recipe?
18,How long does it take to cook Perfect Basic White Rice?
18,What is an optional ingredient in Perfect Basic White Rice?
18,What's the star rating for Perfect Basic White Rice?
18,What should you do after cooking Perfect Basic White Rice for 20 minutes?
19,What ingredients are needed for the Perfect Rump Roast?
19,How long does it take to make the Perfect Rump Roast?
19,How many stars does the Perfect Rump Roast recipe have?
19,What should you not use to cook the Perfect Rump Roast?
19,At what temperature should the oven be pre-heated for the Perfect Rump Roast?
20,What is the name of the chicken recipe shared by the Japanese girl?
20,How long does it take to cook the Japanese Mum's Chicken?
20,What specific ingredient in Japanese Mum's Chicken recipe is crucial for flavor and tasty to eat?
20,How many stars is Japanese Mum's Chicken recipe rated?
20,How do you finish the Japanese Mum's Chicken after cooking it in the liquid?
21,How long does it take to cook the Famous Challah from start to finish?
21,What kind of flour is used in the Famous Challah recipe?
21,What is the rating of the Famous Challah recipe?
21,What optional toppings are suggested for the glaze in the Famous Challah?
21,What is used to prepare the yeast mixture in the Famous Challah recipe?
22,How long does it take to cook the Sweet & Sour Chicken recipe?
22,What is the main protein used in the Sweet & Sour Chicken recipe?
22,What star rating does the Sweet & Sour Chicken recipe have?
22,What ingredient is used to add sweetness in the Sweet & Sour Chicken recipe?
22,Do I need to serve anything with the Sweet & Sour Chicken according to the recipe?
23,How long does the Potato and Buffalo Chicken Casserole take to cook?
23,What is the primary protein used in the Potato and Buffalo Chicken Casserole?
23,What kind of cheese is used in the topping of the Potato and Buffalo Chicken Casserole?
23,How many ratings does the Potato and Buffalo Chicken Casserole have?
23,At what temperature do you initially preheat the oven for the Potato and Buffalo Chicken Casserole?
24,What is the cooking time for Skillet Tarragon Chicken?
24,Can Skillet Tarragon Chicken be made with bone-in chicken breasts?
24,What type of wine is used in Skillet Tarragon Chicken?
24,How many stars is Skillet Tarragon Chicken rated?
24,What should be served alongside Skillet Tarragon Chicken according to the description?
25,How long does it take to cook the Lemon Baked Cod?
25,What is the main ingredient in the Lemon Baked Cod?
25,What temperature should the oven be set to for Lemon Baked Cod?
25,How is paprika used in the Lemon Baked Cod?
25,What type of dish should Lemon Baked Cod be baked in?
26,How long does it take to cook the Oven Barbecue Ribs?
26,What kind of ribs can be used in the Oven Barbecue Ribs recipe?
26,What is the suggested barbecue sauce for the Oven Barbecue Ribs?
26,What is the rating for the Oven Barbecue Ribs recipe?
26,Is smoked paprika a substitute for hickory smoke salt in the Oven Barbecue Ribs recipe?
27,How long does it take to cook the Balsamic Chicken Thighs?
27,Are the Balsamic Chicken Thighs cooked on the stovetop?
27,What can you serve with Balsamic Chicken Thighs according to the recipe description?
27,What kind of vinegar is used in the Balsamic Chicken Thighs recipe?
27,How are the chicken thighs prepared before cooking in the Balsamic Chicken Thighs recipe?
28,What type of ground beef is recommended for The Perfect Burger?
28,How long does it take to cook The Perfect Burger?
28,What is the purpose of making a shallow depression in the burgers according to The Perfect Burger recipe?
28,Can you name some optional 'Flavour Perk Stir-ins' for The Perfect Burger?
28,What is the rating for The Perfect Burger recipe?
29,How long does the Tabbouleh Salad (Parsley Salad) take to make?
29,What type of parsley is recommended for Tabbouleh Salad (Parsley Salad)?
29,Where did you learn to make Tabbouleh Salad (Parsley Salad)?
29,What do you need to do with the bourghul when making Tabbouleh Salad (Parsley Salad)?
29,How should leftovers of Tabbouleh Salad (Parsley Salad) be stored?
30,What type of pasta is used in the Creamy Cajun Chicken Pasta?
30,How long does it take to cook the Creamy Cajun Chicken Pasta?
30,What kind of cheese is used for garnishing the Creamy Cajun Chicken Pasta?
30,What is the main protein ingredient in the Creamy Cajun Chicken Pasta?
30,How is the chicken prepared in the Creamy Cajun Chicken Pasta before cooking?
31,"What type of cheese is used in the Cheese, Potato & Sausage Casserole?"
31,"How long should you bake the Cheese, Potato & Sausage Casserole for?"
31,"What kind of potatoes are suggested for the Cheese, Potato & Sausage Casserole?"
31,"What is the main meat recommended in the Cheese, Potato & Sausage Casserole?"
31,"How do you cut the sausage for the Cheese, Potato & Sausage Casserole?"
32,How long does it take to cook General Tso's Chicken?
32,What type of chilies are suggested for General Tso's Chicken?
32,Can you tell me how the General Tso's Chicken is rated?
32,What is used to coat the chicken in the General Tso's Chicken recipe?
32,What should you do if the sauce for General Tso's Chicken gets too thick?
33,How long does it take to make the Chicken Pot Pie?
33,What is the star rating for the Chicken Pot Pie recipe?
33,Which vegetables are diced for the Chicken Pot Pie?
33,How is the top of the Chicken Pot Pie prepared before baking?
33,At what temperature should I preheat the oven for the Chicken Pot Pie?
34,How long does it take to cook the Beer Bread?
34,What's the overall star rating for the Beer Bread recipe?
34,What kind of beer do you need for the Beer Bread?
34,Are there any ingredients to omit if using Self-Rising Flour in the Beer Bread?
34,Is there a special step when mixing flour for the Beer Bread?
35,What are the key ingredients for Southern Buttermilk Biscuits?
35,How long do you need to bake Southern Buttermilk Biscuits?
35,What's unique about the Southern Buttermilk Biscuits recipe according to the description?
35,Can you use a food processor for Southern Buttermilk Biscuits?
35,What should you preheat the oven to when making Southern Buttermilk Biscuits?
36,How long does it take to cook the Loaded Baked Potato Soup?
36,What type of cheese is used in the Loaded Baked Potato Soup?
36,What is the primary cooking method for the Loaded Baked Potato Soup?
36,What are the starting ingredients for the Loaded Baked Potato Soup?
36,How many stars did the Loaded Baked Potato Soup recipe receive?
37,How long do the Ground Beef Stuffed Green Bell Peppers need to bake in the oven?
37,What type of cheese is used in the Ground Beef Stuffed Green Bell Peppers recipe?
37,What is the suggested cooking time for the Ground Beef Stuffed Green Bell Peppers recipe?
37,What is the main protein ingredient in the Ground Beef Stuffed Green Bell Peppers?
37,How are the green bell peppers prepared before stuffing in the Ground Beef Stuffed Green Bell Peppers recipe?
38,What kind of meat is traditionally used in Traditional Irish Shepherd's Pie?
38,How long does Traditional Irish Shepherd's Pie need to bake in the oven?
38,Is there an option to make individual servings of Traditional Irish Shepherd's Pie?
38,How is the top of the Traditional Irish Shepherd's Pie finished before baking?
38,What is the oven temperature for cooking Traditional Irish Shepherd's Pie?
39,How long does it take to cook the Melt-In-Your-Mouth Chicken Breasts?
39,What is the main ingredient that makes the Melt-In-Your-Mouth Chicken Breasts moist?
39,What temperature should the oven be set to for baking the Melt-In-Your-Mouth Chicken Breasts?
39,How many boneless chicken breast halves are needed for the Melt-In-Your-Mouth Chicken Breasts?
39,What type of cheese is used in the Melt-In-Your-Mouth Chicken Breasts recipe?
40,How long does it take to cook the 30-Minute Chicken & Dumplings?
40,What type of biscuits can be used in the 30-Minute Chicken & Dumplings besides Jiffy Mix?
40,What is the star rating for the 30-Minute Chicken & Dumplings?
40,What ingredients are needed for the 30-Minute Chicken & Dumplings?
40,Is poultry seasoning used in the 30-Minute Chicken & Dumplings recipe?
41,How are the Oven-Roasted Greek Potatoes seasoned before baking?
41,What is a suggested way to prevent sticking when making Oven-Roasted Greek Potatoes?
41,How long do the Oven-Roasted Greek Potatoes need to cook in total?
41,What ingredient is recommended in generous amounts for the Oven-Roasted Greek Potatoes?
41,What does the recipe suggest doing if the pan gets dry while making Oven-Roasted Greek Potatoes?
42,What's the main ingredient in the Classic Potato Salad?
42,How long does it take to cook the Classic Potato Salad?
42,What is sprinkled on top of the Classic Potato Salad before serving?
42,Are there any eggs in the Classic Potato Salad?
42,How would you describe the popularity of the Classic Potato Salad based on its rating?
43,How long does it take to cook Zuppa Toscana?
43,What kind of meat is used in the Zuppa Toscana recipe?
43,What leafy greens can you use in Zuppa Toscana?
43,How many stars does the Zuppa Toscana recipe have?
43,What type of potatoes are used in Zuppa Toscana?
44,How long does it take to cook the Sour Cream Chicken Enchiladas?
44,What main ingredient in the Sour Cream Chicken Enchiladas recipe is used for the sauce?
44,What type of cheese is recommended for Sour Cream Chicken Enchiladas?
44,How are the chicken and onion prepared for the Sour Cream Chicken Enchiladas?
44,What temperature should the oven be set to for baking Sour Cream Chicken Enchiladas?
45,What kind of chicken is used in the Bourbon Chicken recipe?
45,How long does it take to cook the Bourbon Chicken according to the recipe?
45,Why is this recipe called Bourbon Chicken?
45,What is the purpose of using red pepper flakes in the Bourbon Chicken recipe?
45,What is the rating of the Bourbon Chicken recipe based on user reviews?
46,How do you prepare the baking pan for the Simple Baked Chicken Drumsticks?
46,What optional herb can be added to the Simple Baked Chicken Drumsticks?
46,What is the total cooking time for the Simple Baked Chicken Drumsticks?
46,How is the seasoning added to the drumsticks in the recipe for Simple Baked Chicken Drumsticks?
46,What was the overall recipe rating for the Simple Baked Chicken Drumsticks?
47,What type of casserole is the Chicken-Macaroni Casserole?
47,How long does it take to cook the Chicken-Macaroni Casserole?
47,What is the rating for the Chicken-Macaroni Casserole recipe?
47,Does the Chicken-Macaroni Casserole include cheese in its ingredients?
47,What should you sprinkle on top of the Chicken-Macaroni Casserole before baking?
48,How much cheese do I need for the Creamy Burrito Casserole?
48,What's the bake temperature for the Creamy Burrito Casserole?
48,How long does it take to cook the Creamy Burrito Casserole?
48,What meat options are suggested for the Creamy Burrito Casserole?
48,Is sour cream used in the Creamy Burrito Casserole recipe?
49,How spicy is the Chicken Tikka Masala according to the recipe description?
49,What is the total cooking time for the Chicken Tikka Masala?
49,What kind of marinade is used in the Chicken Tikka Masala?
49,What should you use to garnish the Chicken Tikka Masala before serving?
49,What type of cream is used in the Chicken Tikka Masala sauce?
50,How long does it take to cook the Chicken Tortilla Soup from start to finish?
50,What spicy ingredient in the Chicken Tortilla Soup can be adjusted according to taste?
50,What type of broth is used in the Chicken Tortilla Soup?
50,What optional topping is suggested for the Chicken Tortilla Soup?
50,How do you prepare the chicken in the Chicken Tortilla Soup after boiling it?
51,What is the name of the recipe?
51,How long does it take to cook Fantastic Taco Casserole?
51,What type of cheese is recommended in the Fantastic Taco Casserole recipe?
51,At what temperature should you bake Fantastic Taco Casserole?
51,How is the ground beef prepared in the Fantastic Taco Casserole?
52,What ingredients do you need to Broil a Perfect Steak?
52,How long does it take to cook the recipe 'Broil a Perfect Steak'?
52,Can you tell me the rating for the 'Broil a Perfect Steak' recipe?
52,What should you do with the steaks before placing them in the oven according to the 'Broil a Perfect Steak' recipe?
52,What cooking tool is suggested for the 'Broil a Perfect Steak' recipe to turn the steaks?
53,How long does the Award Winning Chili take to cook?
53,What kind of meat is used in the Award Winning Chili?
53,What is the rating for the Award Winning Chili?
53,Can you list some toppings suggested for the Award Winning Chili?
53,What type of beans are included in the Award Winning Chili?
54,What is the name of this corn recipe?
54,How many ears of corn do you need for Simple Oven-Roasted Corn on the Cob?
54,What's the oven temperature for making Simple Oven-Roasted Corn on the Cob?
54,How long does it take to cook Simple Oven-Roasted Corn on the Cob?
54,How many stars has the Simple Oven-Roasted Corn on the Cob recipe been rated?
55,What is the name of the recipe that involves chicken and pasta?
55,How long does it take to cook Angel Chicken Pasta?
55,What star rating does the Angel Chicken Pasta have?
55,Which type of pasta is used in the Angel Chicken Pasta recipe?
55,What kind of sauce is used with the chicken in the Angel Chicken Pasta dish?
56,What is the name of the dish for this recipe?
56,Can you make the Slow-Cooker White Chicken Chili on the stove instead of a slow cooker?
56,What kind of chicken is needed for the Slow-Cooker White Chicken Chili?
56,How long does it take to cook the Slow-Cooker White Chicken Chili in the slow cooker?
56,What are the optional toppings for Slow-Cooker White Chicken Chili?
57,What's the cook time for Broccoli Cheese Soup?
57,How is Broccoli Cheese Soup recommended to be served?
57,What is the main type of cheese used in Broccoli Cheese Soup?
57,Can you describe the rating for Broccoli Cheese Soup?
57,What type of bread is suggested to serve with Broccoli Cheese Soup?
58,What is the name of the recipe that includes Parmesan and breadcrumbs?
58,How long does it take to cook the Oven-baked Parmesan Chicken Strips?
58,What does the recipe description say the aroma of the Oven-baked Parmesan Chicken Strips is like?
58,How is the rating for the Oven-baked Parmesan Chicken Strips based on 74 reviews?
58,What do you need to combine in a shallow dish for the Oven-baked Parmesan Chicken Strips?
59,How long does it take to make the Copycat Red Lobster Cheddar Bay Biscuits?
59,What rating do the Copycat Red Lobster Cheddar Bay Biscuits have?
59,What temperature should the oven be for the Copycat Red Lobster Cheddar Bay Biscuits?
59,What type of cheese is needed for the Copycat Red Lobster Cheddar Bay Biscuits?
59,How do you finish the Copycat Red Lobster Cheddar Bay Biscuits before baking?
60,How much time will it take to prepare Chicken Alfredo?
60,What type of pasta is recommended for Chicken Alfredo?
60,How do you prevent the cooked pasta from sticking in the Chicken Alfredo recipe?
60,What combination of cheeses can be used in the Chicken Alfredo sauce?
60,How is chicken seasoned in the Chicken Alfredo recipe?
61,How long does it take to cook Crock Pot Chicken à La Antoinette on the stove?
61,What kind of soups are used in Crock Pot Chicken à La Antoinette?
61,Can red wine be substituted in Crock Pot Chicken à La Antoinette?
61,What is a suggested way to serve Crock Pot Chicken à La Antoinette?
61,What is the star rating for Crock Pot Chicken à La Antoinette?
62,What's the total cooking time for Curry Chicken?
62,What kind of mustard is used in the Curry Chicken recipe?
62,How is Curry Chicken best served according to the recipe description?
62,How many stars has the Curry Chicken received from reviewers?
62,Which ingredient in the Curry Chicken is responsible for its sweetness?
63,What is the cooking time for the Meatloaf recipe?
63,How many eggs are needed for the Meatloaf?
63,What temperature should the Meatloaf be baked at?
63,What is used as a glaze on top of the Meatloaf?
63,How is the Meatloaf rated on a scale of 5 stars?
64,What's the main meat ingredient in the Hamburger Stroganoff recipe?
64,How long does it take to cook Hamburger Stroganoff?
64,How many stars does the Hamburger Stroganoff recipe have?
64,What do you add to the Hamburger Stroganoff along with sour cream?
64,Is pasta or rice suggested to be served with Hamburger Stroganoff?
65,How long does it take to cook the Thin Pizza Crust?
65,What is the main characteristic of the Thin Pizza Crust described in the recipe?
65,What cooking temperature is recommended for the Thin Pizza Crust?
65,What type of cheese is suggested as a topping for the Thin Pizza Crust?
65,What is the rating of the Thin Pizza Crust recipe?
66,How long does it take to cook the King Ranch Chicken recipe?
66,What type of soups are used in the King Ranch Chicken recipe?
66,What kinds of cheese are needed for the King Ranch Chicken recipe?
66,How is the King Ranch Chicken recipe rated by others?
66,What do you use to layer the bottom of the dish in the King Ranch Chicken recipe?
67,What's the cooking time for Amish Chicken?
67,How many stars is the Amish Chicken recipe rated?
67,What kind of gravy does Amish Chicken make?
67,What temperature should you bake Amish Chicken at?
67,Which ingredients do you need to mix with the flour for Amish Chicken?
68,What is the name of the recipe that uses 1 1/2 lbs of ground beef?
68,How long does 'The Very Best Salisbury Steak' take to cook?
68,What type of soup is used in 'The Very Best Salisbury Steak' recipe?
68,How is 'The Very Best Salisbury Steak' sauce described in its recipe?
68,What is the star rating given to 'The Very Best Salisbury Steak'?
69,How long does it take to cook the Beef Nacho Crescent Bake?
69,What type of cheese is used in the Beef Nacho Crescent Bake recipe?
69,What rating does the Beef Nacho Crescent Bake have?
69,What should be done with the grated cheddar in the Beef Nacho Crescent Bake?
69,Is there an optional ingredient mentioned in the Beef Nacho Crescent Bake recipe?
70,How many sausages are needed for the Italian Sausage Dog?
70,What's the total cooking time for the Italian Sausage Dog?
70,What type of bread is used in the Italian Sausage Dog recipe?
70,Who is the inspiration behind the Italian Sausage Dog recipe?
70,What is added on top of the Italian Sausage Dog before grilling?
71,How long does it take to cook the Flat Iron Steak with Parmesan Sauce?
71,What kind of cheese is used in the Flat Iron Steak with Parmesan Sauce recipe?
71,Can you include shrimp in the Flat Iron Steak with Parmesan Sauce dish?
71,How is the steak prepared before cooking in the Flat Iron Steak with Parmesan Sauce recipe?
71,How many stars does the Flat Iron Steak with Parmesan Sauce recipe have?
72,How long does the Baked Salmon recipe take to prepare?
72,What are the main ingredients in the Baked Salmon recipe?
72,How is the salmon cooked in the Baked Salmon recipe?
72,What is the star rating of the Baked Salmon recipe?
72,What step should be taken before baking the salmon in the Baked Salmon recipe?
73,What is the main seasoning used in Lemon Pepper Chicken Breasts?
73,How long does it take to cook the Lemon Pepper Chicken Breasts?
73,How are the chicken breasts prepared in the Lemon Pepper Chicken Breasts recipe?
73,What kind of rice is used in the Lemon Pepper Chicken Breasts recipe?
73,What is the rating of the Lemon Pepper Chicken Breasts recipe?
74,How long does it take to cook the Sesame Crusted Tuna Steaks?
74,What rating do the Sesame Crusted Tuna Steaks have?
74,What type of vinegar is used in the Sesame Crusted Tuna Steaks?
74,What is the first step in making Sesame Crusted Tuna Steaks?
74,Which ingredient gives the Sesame Crusted Tuna Steaks their crust?
75,What is the cooking time for the Frank and Potato Bake recipe?
75,How is the onion prepared in the Frank and Potato Bake?
