id,question
75,How many ratings does the Frank and Potato Bake have?
75,What type of cheese is used in the Frank and Potato Bake?
75,What is one reason someone might like the Frank and Potato Bake recipe?
76,What ingredients are needed for Teriyaki Pork Chops?
76,How much time does it take to make Teriyaki Pork Chops?
76,What is the rating for the Teriyaki Pork Chops recipe?
76,How are Teriyaki Pork Chops cooked after marinating?
76,Can you use the Teriyaki Pork Chops marinade as a sauce?
77,What is the main flavoring used in Garlic and Oregano Skillet Chicken?
77,How long does it take to cook Garlic and Oregano Skillet Chicken?
77,What rating does the Garlic and Oregano Skillet Chicken recipe have?
77,What type of chicken is used in Garlic and Oregano Skillet Chicken?
77,What should you do with the butter mixture when making Garlic and Oregano Skillet Chicken?
78,How would you describe the taste and texture of the Pulled Pork BBQ?
78,What's the total cooking time for the Pulled Pork BBQ?
78,What is one of the key ingredients in the rub for the Pulled Pork BBQ?
78,How long can you freeze the Pulled Pork BBQ?
78,How would you rate the Pulled Pork BBQ based on this recipe?
79,How much time does the Perfect Slow-Cooker Pot Roast take to cook?
79,What is the main protein in the Perfect Slow-Cooker Pot Roast?
79,What vegetables are included in the Perfect Slow-Cooker Pot Roast?
79,How is the Perfect Slow-Cooker Pot Roast seasoned?
79,How many stars has the Perfect Slow-Cooker Pot Roast recipe received?
80,How many loaves does the Crusty French Bread recipe make?
80,What is the average rating for the Crusty French Bread recipe?
80,How long does it take to bake the Crusty French Bread?
80,What kind of flour is needed for the Crusty French Bread?
80,At what temperature should you bake the Crusty French Bread?
81,What is the total cooking time for the Easy Oven-Baked Cod?
81,What type of fish can be used in the Easy Oven-Baked Cod recipe?
81,What is the star rating for the Easy Oven-Baked Cod recipe?
81,Which ingredient is used for brushing over the cod fillets before baking in the Easy Oven-Baked Cod?
81,What is the temperature setting for the oven in the Easy Oven-Baked Cod recipe?
82,What is the recommended cook time for the Corned Beef & Cabbage recipe?
82,How many stars is the Corned Beef & Cabbage recipe rated?
82,What type of bread does the Corned Beef & Cabbage recipe suggest serving with it?
82,Does the Corned Beef & Cabbage recipe include beer as a suggested ingredient?
82,Who does the description credit for inventing the Corned Beef & Cabbage recipe?
83,What's the overall rating for the Asian Noodle Bowl recipe?
83,How long does it take to cook the Asian Noodle Bowl?
83,Can you list at least three main ingredients in the Asian Noodle Bowl?
83,What should be added to the Asian Noodle Bowl three minutes before the pasta is done?
83,How is the Asian Noodle Bowl garnished before serving?
84,What's the name of the dish described as having gone through many recipe trials?
84,What is the total time needed to prepare the Best Ever Bruschetta?
84,How would you rate the Best Ever Bruschetta based on user feedback?
84,Which type of bread is used in the Best Ever Bruschetta?
84,What is mentioned about the preparation method of tomatoes in the Best Ever Bruschetta?
85,What's the cooking time for Properly Prepared Spaghetti Squash?
85,What does the Properly Prepared Spaghetti Squash description say about serving options?
85,How many stars has Properly Prepared Spaghetti Squash been rated?
85,What main ingredient is needed for Properly Prepared Spaghetti Squash?
85,What warning is given about adding tomato-based sauce to Properly Prepared Spaghetti Squash?
86,What is the cooking time for Teriyaki Chicken Noodle Salad?
86,What type of noodles does the Teriyaki Chicken Noodle Salad recipe suggest?
86,How would you describe the flavor profile of the Teriyaki Chicken Noodle Salad?
86,What is the star rating for the Teriyaki Chicken Noodle Salad recipe?
86,How many spring onions are needed for the Teriyaki Chicken Noodle Salad?
87,What is the rating for the Yakisoba recipe?
87,How long does it take to cook Yakisoba?
87,What type of meat is used in the Yakisoba recipe?
87,Does the Yakisoba recipe include soy sauce?
87,Are scallions optional in the Yakisoba recipe?
